{
  "$schema": "http://json-schema.org/draft-07/schema#",
  "$id": "https://github.com/riccarvalhinho/mtg-recall/data/schema/event.schema.json",
  "title": "Evento",
  "description": "Um torneio, com os seus matches lá dentro. Um ficheiro por evento em data/events/<id>.json. As decisões por trás de cada campo estão em data-model.md e em docs/adr/0002-dados-json-versionados.md.",
  "type": "object",
  "additionalProperties": false,
  "required": [
    "id",
    "name",
    "type",
    "date",
    "status",
    "matches"
  ],
  "properties": {
    "id": {
      "description": "Slug único, igual ao nome do ficheiro sem extensão. Começa pela data para o directório sair por ordem cronológica.",
      "type": "string",
      "pattern": "^[0-9]{4}-[0-9]{2}-[0-9]{2}-[a-z0-9]+(-[a-z0-9]+)*$"
    },
    "name": {
      "description": "Como o evento aparece na app.",
      "type": "string",
      "minLength": 1
    },
    "type": {
      "description": "Formato jogado.",
      "type": "string",
      "enum": [
        "Sealed",
        "Draft",
        "Standard",
        "Modern",
        "Pioneer",
        "Legacy",
        "Commander"
      ]
    },
    "setCode": {
      "description": "Código Scryfall do set (ex.: dft). Só faz sentido em Limited.",
      "type": "string",
      "pattern": "^[a-z0-9]{3,6}$"
    },
    "date": {
      "description": "Dia do torneio. Pode ser retroactiva — não é a data em que o registo foi criado.",
      "type": "string",
      "format": "date"
    },
    "location": {
      "type": "string",
      "minLength": 1
    },
    "status": {
      "description": "Um torneio a decorrer está active. Só deve haver um active de cada vez.",
      "type": "string",
      "enum": [
        "active",
        "completed"
      ]
    },
    "placement": {
      "description": "Posição final no torneio: 1 é o primeiro lugar. É este o campo a sério. Os escalões (Top 8, Top 16, …) não se guardam — deduzem-se daqui em runtime, por domain/placement.ts, como o win rate e os pontos. Ver docs/adr/0012-posicao-final-em-vez-de-escalao.md.",
      "type": "integer",
      "minimum": 1
    },
    "playersCount": {
      "description": "Quantos jogadores tinha o torneio. Sem isto a posição não se compara entre torneios — um 5.º lugar vale coisas diferentes em 8 e em 128 — e o escalão fica por confirmar. Nunca menor do que placement.",
      "type": "integer",
      "minimum": 1
    },
    "rank": {
      "description": "Legado: o escalão escrito à mão (\"Top 8\", \"1st Place\") que existia antes de haver placement. Continua a ler-se para os eventos antigos não perderem o resultado, mas nada novo o escreve — ADR 0012.",
      "type": "string",
      "minLength": 1
    },
    "deckId": {
      "description": "Referência a data/decks/<id>.json. É a forma nova de dizer com que deck se jogou. Quando existe, manda sobre deckName/deckColors.",
      "type": "string",
      "pattern": "^[a-z0-9]+(-[a-z0-9]+)*$"
    },
    "deckName": {
      "description": "Nome do deck escrito à mão. Legado: os eventos anteriores à Fase 2 só têm isto, e continuam a ler-se. Eventos novos usam deckId.",
      "type": "string",
      "minLength": 1
    },
    "deckColors": {
      "description": "Cores do deck escritas à mão. Legado, como o deckName.",
      "$ref": "#/definitions/manaSelection"
    },
    "deckThumbnailCardId": {
      "description": "Scryfall id da carta que ilustra o deck. Fase 3.",
      "type": "string",
      "minLength": 1
    },
    "notes": {
      "type": "string"
    },
    "matches": {
      "description": "Por ordem de ronda. Um evento acabado de criar tem a lista vazia.",
      "type": "array",
      "items": {
        "$ref": "#/definitions/match"
      }
    }
  },
  "definitions": {
    "manaColor": {
      "type": "string",
      "enum": [
        "W",
        "U",
        "B",
        "R",
        "G"
      ]
    },
    "manaSelection": {
      "description": "Cores principais e cores de splash, separadas. Uma cor não pode estar nas duas.",
      "type": "object",
      "additionalProperties": false,
      "required": [
        "main",
        "splash"
      ],
      "properties": {
        "main": {
          "type": "array",
          "items": {
            "$ref": "#/definitions/manaColor"
          },
          "uniqueItems": true
        },
        "splash": {
          "type": "array",
          "items": {
            "$ref": "#/definitions/manaColor"
          },
          "uniqueItems": true
        }
      }
    },
    "match": {
      "type": "object",
      "additionalProperties": false,
      "required": [
        "round",
        "opponentColors",
        "result"
      ],
      "properties": {
        "round": {
          "description": "Identifica o match dentro do evento. Sequencial, a começar em 1.",
          "type": "integer",
          "minimum": 1
        },
        "opponentId": {
          "description": "Referência a data/taxonomies/opponents.json. **Opcional**: um torneio antigo, carregado de memória, pode não ter adversário nenhum de que se lembre. Ausente quer dizer \"não registado\" — e não uma pessoa chamada Unknown, que apareceria nas estatísticas por adversário como se fosse alguém. O match conta na mesma para o registo do evento e para o win rate.",
          "type": "string",
          "pattern": "^[a-z0-9]+(-[a-z0-9]+)*$"
        },
        "opponentColors": {
          "$ref": "#/definitions/manaSelection"
        },
        "result": {
          "description": "Resultado do match. Um D é um empate de match, não de game.",
          "type": "string",
          "enum": [
            "W",
            "L",
            "D"
          ]
        },
        "wentFirst": {
          "description": "true se fui eu a jogar primeiro no primeiro game.",
          "type": "boolean"
        },
        "games": {
          "description": "Registo game a game, para saber que um 2-1 foi 2-1. Opcional: um match pode ser registado só pelo resultado.",
          "type": "array",
          "minItems": 1,
          "maxItems": 5,
          "items": {
            "type": "object",
            "additionalProperties": false,
            "required": [
              "number",
              "result"
            ],
            "properties": {
              "number": {
                "type": "integer",
                "minimum": 1,
                "maximum": 5
              },
              "result": {
                "description": "Sem empates: um game ou se ganha ou se perde.",
                "type": "string",
                "enum": [
                  "W",
                  "L"
                ]
              },
              "wentFirst": {
                "type": "boolean"
              },
              "life": {
                "description": "A vida com que cada um acabou o game. Vem do contador de vida; ausente num game registado a mao. Sem minimo: perde-se a menos de zero, e forcar um zero seria escrever uma coisa que nao aconteceu.",
                "type": "object",
                "additionalProperties": false,
                "required": [
                  "me",
                  "opponent"
                ],
                "properties": {
                  "me": {
                    "type": "integer"
                  },
                  "opponent": {
                    "type": "integer"
                  }
                }
              }
            }
          }
        },
        "notes": {
          "type": "string"
        }
      }
    }
  }
}
