{
  "id": "2025-07-27-pre-release-edge-of-eternities",
  "name": "Pré-release - Edge of Eternities",
  "type": "Sealed",
  "setCode": "eoe",
  "date": "2025-07-27",
  "location": "Dubai",
  "status": "completed",
  "placement": 2,
  "playersCount": 9,
  "deckId": "selesnia-counters",
  "matches": [
    {
      "round": 1,
      "opponentColors": {
        "main": [],
        "splash": []
      },
      "result": "W"
    },
    {
      "round": 2,
      "opponentColors": {
        "main": [],
        "splash": []
      },
      "result": "L"
    },
    {
      "round": 3,
      "opponentColors": {
        "main": [],
        "splash": []
      },
      "result": "W"
    }
  ]
}
