{
  "id": "2025-08-12-draft-edge-of-eternities",
  "name": "Draft - Edge of Eternities",
  "type": "Draft",
  "setCode": "eoe",
  "date": "2025-08-12",
  "location": "Arena Porto",
  "status": "active",
  "deckId": "rakdos-sacrifice",
  "matches": [
    {
      "round": 1,
      "opponentColors": {
        "main": [],
        "splash": []
      },
      "result": "W"
    },
    {
      "round": 2,
      "opponentColors": {
        "main": [],
        "splash": []
      },
      "result": "W"
    },
    {
      "round": 3,
      "opponentColors": {
        "main": [],
        "splash": []
      },
      "result": "W"
    }
  ]
}
